{
  "schema_version": 2,
  "defaults": {"case": "diverted_case", "layout": "mpi4_omp4"},
  "profiles": {
    "routine": {
      "description": "Diverted baseline and short adaptive golden; target about 30 seconds excluding builds",
      "checks": [{"suite": "warm"}, {"suite": "adaptive"}]
    },
    "routine-extended": {
      "description": "Diverted short feature goldens and adaptive detailed diagnostics",
      "checks": [
        {"suite": "warm"}, {"suite": "adaptive_diagnostics"},
        {"suite": "neutral_short"}, {"suite": "impurity_short"},
        {"suite": "moving_equilibrium_short"}, {"suite": "moving_equilibrium_parallel"}
      ]
    },
    "full": {
      "description": "Both topologies, full bootstraps, feature convergence and focused parallel checks",
      "checks": [
        {"suite": "bootstrap"}, {"suite": "bootstrap_limited"},
        {"suite": "warm"}, {"suite": "warm", "case": "legacy_case"},
        {"suite": "transport"}, {"suite": "transport", "case": "legacy_case"},
        {"suite": "transport_hybrid"}, {"suite": "transport_parallel", "case": "legacy_case"},
        {"suite": "adaptive_parallel"}, {"suite": "neutrals"}, {"suite": "neutral_wall"}, {"suite": "neutral_parallel"},
        {"suite": "impurities"}, {"suite": "mixture_parallel"}, {"suite": "stored_field"},
        {"suite": "neutralgamma"}, {"suite": "initialization"},
        {"suite": "moving_equilibrium"}, {"suite": "moving_equilibrium_short"},
        {"suite": "moving_equilibrium_parallel"}
      ]
    }
  },
  "suites": {
    "moving_equilibrium": {
      "description": "Full 80 ms feedback golden and expected 100 ms refinement-limit prefix golden",
      "case": "moving_equilibrium",
      "workflows": ["mode1", "refinement_limit"]
    },
    "moving_equilibrium_short": {
      "description": "Short 80 ms prescribed-puff and recycling-feedback goldens with off-knot controls",
      "case": "moving_equilibrium",
      "workflows": ["mode0_short", "mode2_short"]
    },
    "moving_equilibrium_parallel": {
      "description": "Short 80 ms puff feedback: MPI1/OMP1 versus MPI4/OMP1",
      "case": "moving_equilibrium",
      "workflows": ["mode1_short"],
      "layouts": ["mpi1_omp1", "mpi4_omp1"],
      "relations": ["mpi"],
      "reference_comparisons": false,
      "tolerance_profile": "fixed_cross_layout",
      "layout_comparison_policy": "fixed_hdf5"
    },
    "warm": {
      "description": "Transport-off warm baseline: convergence and own golden",
      "workflows": ["baseline_warm"]
    },
    "bootstrap": {
      "description": "Full three-stage adaptive bootstrap with stage acceptance and final golden",
      "workflows": ["bootstrap_adaptive"]
    },
    "bootstrap_limited": {
      "description": "Full limited adaptive and fixed bootstraps on accepted mesh inputs",
      "case": "legacy_case",
      "workflows": ["bootstrap_adaptive", "bootstrap_fixed"],
      "workflow_comparison": ["bootstrap_fixed", "bootstrap_adaptive"]
    },
    "adaptive": {
      "description": "Short adaptive source-relocation golden, diagnostics off",
      "workflows": ["adaptive_source_short"]
    },
    "adaptive_diagnostics": {
      "description": "Short adaptive source-relocation golden with detailed diagnostics",
      "workflows": ["adaptive_source_short"],
      "diagnostics": "detailed"
    },
    "adaptive_parallel": {
      "description": "Short adaptive source-relocation golden, OpenMP/MPI and detailed diagnostics",
      "workflows": ["adaptive_source_short"],
      "relations": ["openmp", "mpi"],
      "reference_comparisons": true,
      "tolerance_profile": "race_step",
      "layout_comparison_policy": "fixed_hdf5",
      "diagnostics": "detailed"
    },
    "transport": {
      "description": "Five-stage transport activation: convergence and final golden",
      "workflows": ["transport"]
    },
    "transport_parallel": {
      "description": "Short transport golden, OpenMP/MPI and detailed diagnostics",
      "workflows": ["transport_short"],
      "relations": ["openmp", "mpi"],
      "reference_comparisons": true,
      "tolerance_profile": "race_step",
      "diagnostics": "detailed"
    },
    "transport_hybrid": {
      "description": "Short transport golden, OpenMP/MPI/hybrid and detailed diagnostics",
      "workflows": ["transport_short"],
      "relations": ["openmp", "mpi", "hybrid"],
      "reference_comparisons": true,
      "tolerance_profile": "race_step",
      "diagnostics": "detailed"
    },
    "neutrals": {
      "description": "Source relocation and independent neutral features: convergence and own goldens",
      "workflows": ["source_relocation", "neutral_pressure", "neutral_perpendicular", "neutral_limiter_fixed", "neutral_limiter_ti"]
    },
    "neutral_short": {
      "description": "Short pressure, perpendicular diffusion and both limiter goldens",
      "workflows": ["neutral_pressure_short", "neutral_perpendicular_short", "neutral_limiter_fixed_short", "neutral_limiter_ti_short"]
    },
    "neutral_wall": {
      "description": "Converged atomic wall absorption and independent pump-wall recycling goldens",
      "workflows": ["neutral_wall_absorption", "neutral_wall_absorption_pump"],
      "diagnostics": "detailed"
    },
    "neutral_parallel": {
      "description": "Short neutral-feature goldens and focused OpenMP/MPI comparisons",
      "workflows": ["neutral_pressure_short", "neutral_perpendicular_short", "neutral_limiter_fixed_short", "neutral_limiter_ti_short"],
      "relations": ["openmp", "mpi"],
      "reference_comparisons": true,
      "tolerance_profile": "neutral_feature_race_step"
    },
    "impurities": {
      "description": "Radiation off, N and N+W: convergence and own goldens",
      "workflows": ["impurity_off", "impurity_n", "impurity_nw"]
    },
    "impurity_short": {
      "description": "Short radiation-off, N and N+W goldens",
      "workflows": ["impurity_off_short", "impurity_n_short", "impurity_nw_short"]
    },
    "mixture_parallel": {
      "description": "Short N+W golden and OpenMP agreement",
      "workflows": ["impurity_nw_short"],
      "relations": ["openmp"],
      "reference_comparisons": true,
      "tolerance_profile": "race_step"
    },
    "stored_field": {
      "description": "Stored magnetic/current fields: convergence and own golden",
      "workflows": ["stored_field"]
    },
    "neutralgamma": {
      "description": "Six-equation analytical initialization, radiation off, OpenMP and detailed diagnostics",
      "case": "legacy_case",
      "workflows": ["cold_step_neutralgamma"],
      "relations": ["openmp"],
      "tolerance_profile": "race_step",
      "diagnostics": "detailed"
    },
    "initialization": {
      "description": "Analytical initialization with impurity radiation disabled",
      "case": "legacy_case",
      "workflows": ["cold_step_impurity_off"],
      "layouts": ["serial_omp1"],
      "reference_comparisons": false
    }
  }
}
